{
 "gridW": 16,
 "gridH": 16,
 "startCol": 8,
 "startRow": 10,
 "roomTypeGrid": [
  [
   0,
   20,
   20,
   26,
   22,
   20,
   20,
   22,
   20,
   26,
   27,
   20,
   26,
   20,
   22,
   2
  ],
  [
   38,
   33,
   29,
   28,
   17,
   12,
   13,
   23,
   29,
   23,
   29,
   33,
   17,
   31,
   11,
   3
  ],
  [
   37,
   21,
   21,
   13,
   11,
   12,
   18,
   24,
   21,
   17,
   23,
   24,
   24,
   18,
   17,
   30
  ],
  [
   37,
   24,
   17,
   12,
   5,
   18,
   21,
   32,
   28,
   25,
   17,
   11,
   11,
   45,
   17,
   3
  ],
  [
   39,
   28,
   21,
   18,
   8,
   24,
   21,
   13,
   31,
   31,
   28,
   24,
   21,
   8,
   17,
   30
  ],
  [
   39,
   33,
   5,
   17,
   31,
   28,
   17,
   12,
   18,
   18,
   13,
   23,
   24,
   13,
   11,
   3
  ],
  [
   39,
   23,
   17,
   11,
   31,
   12,
   17,
   46,
   11,
   17,
   12,
   21,
   17,
   31,
   23,
   30
  ],
  [
   37,
   17,
   23,
   8,
   18,
   13,
   11,
   10,
   15,
   10,
   12,
   17,
   23,
   13,
   23,
   34
  ],
  [
   40,
   11,
   11,
   31,
   45,
   18,
   21,
   16,
   7,
   16,
   18,
   21,
   32,
   31,
   28,
   35
  ],
  [
   37,
   5,
   24,
   29,
   11,
   23,
   17,
   14,
   6,
   14,
   47,
   17,
   12,
   18,
   29,
   3
  ],
  [
   37,
   32,
   28,
   25,
   21,
   24,
   21,
   18,
   8,
   18,
   17,
   23,
   18,
   21,
   32,
   30
  ],
  [
   40,
   33,
   29,
   31,
   28,
   8,
   32,
   23,
   29,
   28,
   21,
   11,
   23,
   11,
   31,
   34
  ],
  [
   39,
   11,
   45,
   18,
   29,
   31,
   33,
   17,
   28,
   13,
   23,
   8,
   24,
   24,
   29,
   34
  ],
  [
   37,
   24,
   5,
   5,
   32,
   33,
   32,
   11,
   31,
   12,
   17,
   31,
   28,
   21,
   24,
   35
  ],
  [
   41,
   8,
   25,
   21,
   18,
   32,
   33,
   25,
   29,
   33,
   21,
   29,
   31,
   28,
   21,
   35
  ],
  [
   4,
   42,
   44,
   43,
   43,
   42,
   43,
   42,
   43,
   43,
   43,
   43,
   42,
   42,
   43,
   9
  ]
 ],
 "numTemplates": 48,
 "templates": {
  "0": [
   {
    "graphic": "7C0C",
    "x": 0,
    "y": 2
   },
   {
    "graphic": "7B11",
    "x": 7,
    "y": 2
   },
   {
    "graphic": "7BB7",
    "x": 13,
    "y": 2
   },
   {
    "graphic": "7C0C",
    "x": 16,
    "y": 2
   },
   {
    "graphic": "7BB7",
    "x": 23,
    "y": 2
   },
   {
    "graphic": "7B11",
    "x": 26,
    "y": 2
   },
   {
    "graphic": "7CCD",
    "x": 0,
    "y": 5
   },
   {
    "graphic": "8047",
    "x": 0,
    "y": 11
   },
   {
    "graphic": "81C5",
    "x": 0,
    "y": 17
   },
   {
    "graphic": "7298",
    "x": 10,
    "y": 8
   },
   {
    "graphic": "71B3",
    "x": 12,
    "y": 8
   },
   {
    "graphic": "72F6",
    "x": 17,
    "y": 8
   },
   {
    "graphic": "71B3",
    "x": 25,
    "y": 8
   },
   {
    "graphic": "7298",
    "x": 30,
    "y": 8
   },
   {
    "graphic": "7523",
    "x": 8,
    "y": 17
   },
   {
    "graphic": "771F",
    "x": 16,
    "y": 17
   },
   {
    "graphic": "7523",
    "x": 21,
    "y": 17
   },
   {
    "graphic": "7462",
    "x": 29,
    "y": 17
   }
  ],
  "1": [
   {
    "graphic": "70BC",
    "x": 0,
    "y": 2
   },
   {
    "graphic": "70BC",
    "x": 11,
    "y": 2
   },
   {
    "graphic": "70BC",
    "x": 23,
    "y": 2
   },
   {
    "graphic": "78F2",
    "x": 20,
    "y": 2
   },
   {
    "graphic": "7298",
    "x": 0,
    "y": 8
   },
   {
    "graphic": "7298",
    "x": 10,
    "y": 8
   },
   {
    "graphic": "71B3",
    "x": 2,
    "y": 8
   },
   {
    "graphic": "72F6",
    "x": 12,
    "y": 8
   },
   {
    "graphic": "71B3",
    "x": 20,
    "y": 8
   },
   {
    "graphic": "7298",
    "x": 28,
    "y": 8
   },
   {
    "graphic": "7298",
    "x": 30,
    "y": 8
   },
   {
    "graphic": "7462",
    "x": 0,
    "y": 17
   },
   {
    "graphic": "7523",
    "x": 3,
    "y": 17
   },
   {
    "graphic": "7523",
    "x": 16,
    "y": 17
   },
   {
    "graphic": "7462",
    "x": 24,
    "y": 17
   },
   {
    "graphic": "7298",
    "x": 14,
    "y": 19
   },
   {
    "graphic": "771F",
    "x": 27,
    "y": 17
   },
   {
    "graphic": "785E",
    "x": 0,
    "y": 13
   }
  ],
  "2": [
   {
    "graphic": "7B11",
    "x": 0,
    "y": 2
   },
   {
    "graphic": "7B11",
    "x": 6,
    "y": 2
   },
   {
    "graphic": "7C0C",
    "x": 12,
    "y": 2
   },
   {
    "graphic": "7BB7",
    "x": 19,
    "y": 2
   },
   {
    "graphic": "78F2",
    "x": 22,
    "y": 2
   },
   {
    "graphic": "7C0C",
    "x": 25,
    "y": 2
   },
   {
    "graphic": "7CCD",
    "x": 25,
    "y": 5
   },
   {
    "graphic": "8047",
    "x": 25,
    "y": 11
   },
   {
    "graphic": "81C5",
    "x": 25,
    "y": 17
   },
   {
    "graphic": "7298",
    "x": 0,
    "y": 8
   },
   {
    "graphic": "72F6",
    "x": 2,
    "y": 8
   },
   {
    "graphic": "71B3",
    "x": 13,
    "y": 8
   },
   {
    "graphic": "7298",
    "x": 18,
    "y": 8
   },
   {
    "graphic": "71B3",
    "x": 20,
    "y": 8
   },
   {
    "graphic": "771F",
    "x": 0,
    "y": 17
   },
   {
    "graphic": "7462",
    "x": 5,
    "y": 17
   },
   {
    "graphic": "771F",
    "x": 8,
    "y": 17
   },
   {
    "graphic": "7523",
    "x": 17,
    "y": 17
   }
  ],
  "3": [
   {
    "graphic": "70BC",
    "x": 0,
    "y": 2
   },
   {
    "graphic": "7981",
    "x": 9,
    "y": 2
   },
   {
    "graphic": "9673",
    "x": 13,
    "y": 2
   },
   {
    "graphic": "9673",
    "x": 16,
    "y": 2
   },
   {
    "graphic": "78F2",
    "x": 17,
    "y": 2
   },
   {
    "graphic": "7947",
    "x": 20,
    "y": 2
   },
   {
    "graphic": "78F2",
    "x": 22,
    "y": 2
   },
   {
    "graphic": "7298",
    "x": 0,
    "y": 8
   },
   {
    "graphic": "71B3",
    "x": 2,
    "y": 8
   },
   {
    "graphic": "7298",
    "x": 7,
    "y": 8
   },
   {
    "graphic": "71B3",
    "x": 13,
    "y": 8
   },
   {
    "graphic": "7298",
    "x": 18,
    "y": 8
   },
   {
    "graphic": "7298",
    "x": 20,
    "y": 8
   },
   {
    "graphic": "7523",
    "x": 0,
    "y": 17
   },
   {
    "graphic": "7523",
    "x": 8,
    "y": 17
   },
   {
    "graphic": "7523",
    "x": 16,
    "y": 17
   },
   {
    "graphic": "7C0C",
    "x": 25,
    "y": 2
   },
   {
    "graphic": "7CCD",
    "x": 25,
    "y": 5
   },
   {
    "graphic": "8047",
    "x": 25,
    "y": 11
   },
   {
    "graphic": "81C5",
    "x": 25,
    "y": 17
   }
  ],
  "4": [
   {
    "graphic": "7C0C",
    "x": 0,
    "y": 2
   },
   {
    "graphic": "7CCD",
    "x": 0,
    "y": 5
   },
   {
    "graphic": "8047",
    "x": 0,
    "y": 11
   },
   {
    "graphic": "81C5",
    "x": 0,
    "y": 17
   },
   {
    "graphic": "8382",
    "x": 7,
    "y": 20
   },
   {
    "graphic": "7E4B",
    "x": 8,
    "y": 17
   },
   {
    "graphic": "7E4B",
    "x": 16,
    "y": 17
   },
   {
    "graphic": "7E4B",
    "x": 24,
    "y": 17
   },
   {
    "graphic": "78F2",
    "x": 7,
    "y": 2
   },
   {
    "graphic": "70BC",
    "x": 10,
    "y": 2
   },
   {
    "graphic": "7947",
    "x": 19,
    "y": 2
   },
   {
    "graphic": "70BC",
    "x": 23,
    "y": 2
   },
   {
    "graphic": "7298",
    "x": 7,
    "y": 8
   },
   {
    "graphic": "7298",
    "x": 9,
    "y": 8
   },
   {
    "graphic": "72F6",
    "x": 11,
    "y": 8
   },
   {
    "graphic": "72F6",
    "x": 19,
    "y": 8
   },
   {
    "graphic": "7298",
    "x": 30,
    "y": 8
   }
  ],
  "5": [
   {
    "graphic": "7981",
    "x": 0,
    "y": 2
   },
   {
    "graphic": "70BC",
    "x": 4,
    "y": 2
   },
   {
    "graphic": "7947",
    "x": 13,
    "y": 2
   },
   {
    "graphic": "78F2",
    "x": 17,
    "y": 2
   },
   {
    "graphic": "7947",
    "x": 20,
    "y": 2
   },
   {
    "graphic": "78F2",
    "x": 22,
    "y": 2
   },
   {
    "graphic": "78F2",
    "x": 25,
    "y": 2
   },
   {
    "graphic": "7981",
    "x": 28,
    "y": 2
   },
   {
    "graphic": "78F2",
    "x": 4,
    "y": 5
   },
   {
    "graphic": "7947",
    "x": 24,
    "y": 5
   },
   {
    "graphic": "7298",
    "x": 26,
    "y": 5
   },
   {
    "graphic": "8E18",
    "x": 13,
    "y": 8
   },
   {
    "graphic": "7462",
    "x": 0,
    "y": 17
   },
   {
    "graphic": "7462",
    "x": 3,
    "y": 17
   },
   {
    "graphic": "7523",
    "x": 6,
    "y": 17
   },
   {
    "graphic": "7462",
    "x": 18,
    "y": 17
   },
   {
    "graphic": "7462",
    "x": 21,
    "y": 17
   },
   {
    "graphic": "7523",
    "x": 24,
    "y": 17
   },
   {
    "graphic": "785E",
    "x": 0,
    "y": 13
   },
   {
    "graphic": "785E",
    "x": 28,
    "y": 13
   },
   {
    "graphic": "78F2",
    "x": 25,
    "y": 14
   },
   {
    "graphic": "7947",
    "x": 4,
    "y": 14
   }
  ],
  "6": [
   {
    "graphic": "8558",
    "x": 0,
    "y": 2
   },
   {
    "graphic": "847C",
    "x": 4,
    "y": 2
   },
   {
    "graphic": "83D2",
    "x": 12,
    "y": 2
   },
   {
    "graphic": "8427",
    "x": 17,
    "y": 2
   },
   {
    "graphic": "847C",
    "x": 20,
    "y": 2
   },
   {
    "graphic": "8558",
    "x": 28,
    "y": 2
   },
   {
    "graphic": "71B3",
    "x": 0,
    "y": 8
   },
   {
    "graphic": "72F6",
    "x": 5,
    "y": 8
   },
   {
    "graphic": "7298",
    "x": 13,
    "y": 8
   },
   {
    "graphic": "7298",
    "x": 15,
    "y": 8
   },
   {
    "graphic": "71B3",
    "x": 17,
    "y": 8
   },
   {
    "graphic": "7298",
    "x": 22,
    "y": 8
   },
   {
    "graphic": "72F6",
    "x": 24,
    "y": 8
   },
   {
    "graphic": "7462",
    "x": 0,
    "y": 17
   },
   {
    "graphic": "7462",
    "x": 3,
    "y": 17
   },
   {
    "graphic": "7462",
    "x": 6,
    "y": 17
   },
   {
    "graphic": "771F",
    "x": 9,
    "y": 17
   },
   {
    "graphic": "7462",
    "x": 18,
    "y": 17
   },
   {
    "graphic": "7462",
    "x": 21,
    "y": 17
   },
   {
    "graphic": "7523",
    "x": 24,
    "y": 17
   }
  ],
  "7": [
   {
    "graphic": "8C5C",
    "x": 0,
    "y": 2
   },
   {
    "graphic": "847C",
    "x": 4,
    "y": 2
   },
   {
    "graphic": "847C",
    "x": 12,
    "y": 2